{
  "schema_version": "1.1",
  "task_packet_id": "tp_auth_refactor_001",
  "project_id": "proj_customer_support_ai",
  "environment": "preprod",
  "task_type": "refactor",
  "task_summary": "Refactor auth middleware and token validation path for API service",
  "affected_components": [
    "api-service"
  ],
  "relevant_controls": [
    "authz_checks",
    "audit_logging",
    "input_validation"
  ],
  "relevant_rai_requirements": [
    "transparency.model_provenance_logging_required"
  ],
  "allowed_actions": [
    "code_edit",
    "test_create",
    "test_run"
  ],
  "blocked_actions": [
    "prod_deploy",
    "privileged_iam_changes"
  ],
  "required_tests": [
    "authz_negative_tests",
    "token_validation_error_handling_tests"
  ],
  "approval_triggers": [
    "auth_flow_change"
  ],
  "evidence_required": [
    "decision_trace",
    "test_results"
  ],
  "reassessment_triggers": [
    "new_external_integration",
    "new_trust_boundary"
  ],
  "references": [
    {
      "ref_id": "pkg_customer_support_ai_preprod_001",
      "kind": "artifact",
      "summary": "Base compiled package"
    }
  ],
  "trace_id": "trc_taskpkt_001",
  "generated_at": "2026-02-21T10:30:00-06:00",
  "context_budget": {
    "max_tokens_hint": 2400,
    "deep_fetch_required": false
  }
}
